{
  "baseline": {
    "ewc_decay": 0.9,
    "ewc_lambda": 10.0,
    "head_type": "linear",
    "hidden_dim": null,
    "learning_rate": 0.1,
    "replay_batch_size": 32,
    "replay_buffer_size": 512,
    "update_steps": 1,
    "weight_decay": 0.0
  },
  "execution": {
    "device": "cuda"
  },
  "hdc": {
    "hypervector_dim": 10000
  },
  "metrics": {
    "ece_bins": 15,
    "stabilization_consecutive_windows": 3,
    "stabilization_min_accuracy": 0.8,
    "stabilization_window": 20
  },
  "protocol": {
    "bootstrap": {
      "counts_toward_budget": false,
      "held_back_image_ids_by_seed": {
        "0": [
          "10063",
          "10201",
          "10299",
          "10419",
          "10505",
          "10513",
          "10523",
          "10525",
          "10612",
          "10677",
          "10682",
          "10950",
          "10970",
          "11148",
          "11165",
          "11179",
          "11193",
          "11321",
          "11346",
          "11402",
          "11438",
          "11443",
          "11523",
          "11533",
          "11537",
          "11556",
          "11568",
          "11618",
          "11622",
          "11655",
          "11759",
          "11785",
          "11860",
          "11942",
          "12152",
          "12197",
          "12285",
          "12348",
          "12452",
          "12476",
          "12515",
          "12543",
          "12604",
          "12723",
          "13051",
          "13082",
          "13109",
          "13180",
          "13305",
          "13338",
          "13392",
          "13426",
          "13454",
          "13583",
          "13626",
          "13667",
          "13813",
          "13828",
          "13945",
          "14035",
          "14148",
          "14163",
          "14168",
          "14322",
          "14419",
          "14518",
          "14623",
          "14756",
          "14965",
          "14994",
          "15019",
          "15043",
          "15141",
          "15227",
          "15267",
          "15367",
          "15381",
          "15416",
          "15427",
          "15497",
          "15624",
          "15702",
          "15769",
          "15782",
          "15842",
          "15846",
          "15861",
          "15969",
          "16075",
          "16080",
          "16108",
          "16186",
          "16350",
          "16362",
          "16395",
          "16491",
          "16523",
          "16571",
          "16621",
          "16643",
          "16678",
          "16991",
          "17026",
          "17129",
          "17135",
          "17261",
          "17268",
          "17310",
          "17316",
          "17349",
          "17354",
          "17463",
          "17573",
          "17595",
          "17839",
          "18017",
          "18042",
          "18088",
          "18204",
          "18418",
          "18425",
          "18437",
          "18590",
          "18648",
          "18649",
          "18672",
          "18711",
          "18804",
          "18830",
          "18831",
          "18891",
          "18946",
          "18989",
          "19076",
          "19143",
          "19156",
          "19167",
          "19305",
          "19417",
          "19446",
          "19501",
          "19503",
          "19511",
          "19546",
          "19580",
          "19648",
          "19667",
          "19705",
          "19769",
          "19905",
          "19989",
          "20041",
          "20205",
          "20213",
          "20225",
          "20359",
          "20360",
          "20405",
          "20589",
          "20687",
          "20693",
          "20714",
          "20721",
          "20733",
          "20793",
          "20906",
          "20907",
          "20963",
          "21011",
          "21025",
          "21037",
          "21083",
          "21232",
          "21345",
          "21348",
          "21419",
          "21655",
          "21873",
          "22006",
          "22067",
          "22101",
          "22483",
          "22631",
          "22709",
          "22752",
          "22789",
          "22799",
          "22823",
          "22847",
          "22860",
          "22964",
          "22999",
          "23000",
          "23031",
          "23067",
          "23216",
          "23313",
          "23389",
          "23433",
          "23471",
          "23528",
          "23570",
          "23651",
          "23769",
          "23927",
          "24081",
          "24335",
          "24352",
          "24465",
          "24501",
          "24630",
          "24751",
          "24887",
          "24931",
          "24957",
          "25018",
          "25056",
          "25145",
          "25159",
          "25169",
          "25174",
          "25225",
          "25338",
          "25431",
          "25526",
          "25560",
          "25566",
          "25571",
          "25698",
          "25800",
          "25899",
          "25980",
          "26042",
          "26071",
          "26118",
          "26151",
          "26247",
          "26321",
          "26411",
          "26446",
          "26538",
          "26545",
          "26547",
          "26622",
          "26777",
          "26784",
          "26798",
          "26801",
          "26950",
          "26951",
          "26998",
          "27013",
          "27074",
          "27174",
          "27260",
          "27275",
          "27321",
          "27362",
          "27464",
          "27476",
          "27556",
          "27675",
          "27837",
          "27879",
          "27884",
          "27978",
          "27998",
          "28269",
          "28295",
          "28519",
          "28569",
          "28846",
          "29077",
          "29395",
          "29540",
          "29594",
          "29695",
          "29851",
          "29893",
          "29906",
          "29910",
          "29915",
          "29942",
          "29943",
          "29969",
          "29971",
          "30075",
          "30099",
          "30252",
          "30315",
          "30342",
          "30373",
          "30448",
          "30464",
          "30711",
          "30732",
          "30737",
          "30879",
          "30931",
          "30945",
          "30981",
          "30992",
          "31093",
          "31196",
          "31251",
          "31263",
          "31264",
          "31314",
          "31335",
          "31388",
          "31395",
          "31442",
          "31478",
          "31514",
          "31581",
          "31628",
          "31679",
          "31760",
          "31812",
          "31849",
          "31886",
          "31902",
          "31911",
          "31993",
          "32018",
          "32138",
          "32147",
          "32180",
          "32213",
          "32220",
          "32295",
          "32712",
          "32727",
          "32811",
          "32834",
          "32906",
          "32937",
          "32947",
          "32957",
          "32998",
          "33205",
          "33322",
          "33328",
          "33371",
          "33416",
          "33451",
          "33640",
          "33705",
          "33731",
          "33733",
          "34003",
          "34031",
          "34075",
          "34117",
          "34148",
          "34168",
          "34178",
          "34214",
          "34294",
          "34807",
          "34849",
          "34852",
          "34862",
          "34967",
          "35008",
          "35043",
          "35094",
          "35111",
          "35220",
          "35267",
          "35289",
          "35425",
          "35443",
          "35546",
          "35559",
          "35601",
          "35932",
          "36025",
          "36060",
          "36208",
          "36224",
          "36321",
          "36326",
          "36434",
          "36465",
          "36480",
          "36504",
          "36675",
          "36700",
          "36816",
          "36883",
          "36970",
          "37037",
          "37093",
          "37169",
          "37410",
          "37503",
          "37541",
          "37822",
          "37893",
          "37905",
          "37953",
          "38019",
          "38171",
          "38235",
          "38267",
          "38281",
          "38304",
          "38456",
          "38882",
          "38887",
          "38904",
          "38941",
          "39401",
          "39525",
          "39588",
          "39774",
          "39864",
          "39986",
          "40053",
          "40097",
          "40176",
          "40184",
          "40350",
          "40372",
          "40384",
          "40387",
          "40518",
          "40604",
          "40821",
          "40865",
          "40971",
          "40993",
          "41014",
          "41129",
          "41249",
          "41304",
          "41423",
          "41439",
          "41553",
          "41557",
          "41568",
          "41575",
          "41579",
          "41596",
          "41618",
          "41809",
          "41903",
          "41923",
          "41963",
          "42013",
          "42066",
          "42120",
          "42159",
          "42164",
          "42287",
          "42409",
          "42443",
          "42534",
          "42627",
          "42718",
          "42729",
          "42795",
          "42818",
          "43044",
          "43157",
          "43424",
          "43497",
          "43723",
          "43765",
          "43778",
          "43801",
          "43813",
          "43832",
          "44091",
          "44188",
          "44233",
          "44503",
          "44522",
          "44685",
          "44760",
          "44764",
          "44848",
          "44874",
          "44922",
          "44970",
          "44980",
          "45103",
          "45268",
          "45510",
          "45857",
          "45893",
          "45962",